Source	In/Out	Accept	Sent	Simple	Copula	Pred/SC	Result/Depictive	Particle	VP Adjunct	NP Adjunct	Temporal	Locative	Misc	Oblique	PP Arg-VP	PPArg-NP/AP	by-Phrase	Expletive	High Arity	Drop Arg	Add Arg	Passive	Imperative	Binding:Refl	Binding:Other	Matrix Q	Emb Q	Complex QP	RC	Island	CP Subj	CP Arg VP	CP Arg NP/AP	Non-finite CP	No C-izer	Deep Embed	Neg	Modal	Aux	Psuedo-Aux	Control	Raising	VP+Extract	VP arg-NP/AP	Non-finite VP Misc	Deverbal 	Rel NP	Trans NP	Compx NP	NNCompd	Rel Adj	Trans Adj	Dislocation	Info Struc	Frag/Paren	Coord	Subordinate/Cond	Ellipsis/Anaphor	S-Adjunct	Quantifier	Partitive	NPI/FCI	Comparative	Sem  Violation	Infl/Agr Violation	Extra/Mising Expr
c-05	Out	0	John was seen the book.																			1																																												1
c-05	Out	1	The book was written.																	1		1																																												
c-05	Out	0	John was spoke by Mary to.														1					1																	1														1												1	
c-05	Out	1	The table was wiped clean by John.				1										1					1																	1																											
c-05	Out	0	The table was wiped by John clean.				1										1					1																																												
c-05	Out	0	Mary was given by John the book.											1			1		1			1																	1														1													
c-05	Out	1	John was believed to be telling the truth by Mary.														1		1			1																	1			1																								
c-05	Out	1	John was believed by Mary to be telling the truth.														1		1			1																	1			1																								
c-05	Out	1	The car was driven by John to Maine.						1			1					1					1																	1														1													
c-05	Out	1	It was believed by the students that they would have an exam.												1		1	1				1																																												
c-05	Out	0	The magazines were sent to herself by Mary.											1	1		1		1			1		1																																										
c-05	Out	0	Chocolate eggs were hidden from each other by the children.											1	1		1		1			1		1																										1																
c-05	Out	1	The magazines were sent by Mary to herself.											1	1		1		1			1		1																																										
c-05	Out	1	Chocolate eggs were hidden from no child by any adult.											1	1		1		1			1															1													1												1				
c-05	Out	1	Tabs were kept on each agent by the other.											1	1		1		1			1		1															1																					1						
c-05	Out	1	Chocolate eggs were hidden from every child by his mother.											1	1		1		1			1			1														1																					1						
c-05	Out	1	Books were taken from no student and given to Mary.											1	1					1		1															1																							1						
c-05	Out	0	Books were taken from no student and given to Mary by any professor.											1	1		1		1			1															1																			1				1		1				
c-05	Out	1	Books were taken from each student by the other.											1	1		1		1			1		1																																				1						
c-05	Out	1	Books were taken from each student and given to Mary.											1	1					1		1																																		1										
c-05	Out	0	Books were taken from each student and given to Mary by the other.											1	1		1		1			1		1															1																					1						
j_71	Out	1	Jack hates Sue and is loved by Mary.														1					1																	1																	1										
j_71	Out	1	Vera sent a baby alligator to Max and a leather dinosaur to Phyllis.											1	1				1																																					1										
j_71	Out	1	Either Sam plays the bassoon or Jekyll the oboe.																																																					1		1								
j_71	Out	1	Sam doesn't play bassoon, nor Medusa oboe.																																		1		1																	1		1								
j_71	Out	0	Bill ate the peaches, but Harry the grapes.																																																					1		1								
j_71	Out	1	I no more could have stolen that steak than Jack the diamonds.																																		1	1	1														1				1	1					1			
j_71	Out	1	Bill ate more peaches than Harry did grapes.																																																							1		1			1			
j_71	Out	0	Bill ate the peaches and Harry did the grapes.																																																					1		1								
j_71	Out	0	Tom will smoke the grass, and Reuben has the hash.																																			1	1																	1		1								
j_71	Out	1	If the ants were called elephants and elephants ants, I'd be able to squash an elephant.		1															1		1																1						1								1				1	1	1								
j_71	Out	1	Simon quickly dropped the gold, and Jack the diamonds.						1				1																																											1		1								
j_71	Out	1	Bob tried to wash himself, and Mary to read the funnies.																					1																	1															1		1								
j_71	Out	1	Harry told Sue that Albania is a lovely place for a vacation, and Tom told Sally that Albania is a lovely place for a vacation.							1			1						1													1																								1										
j_71	Out	1	Harry told Sue that Albania is a lovely place for a vacation, and Tom.		1					1			1						1													1																	1				1			1		1								
j_71	Out	1	Max seemed to be trying to begin to love Harriet, and Fred to be trying to begin to love Sue.																																	1					1	1														1		1								
j_71	Out	1	Max seemed to be trying to force Ted to leave the room, and Walt, Ira.																																	1			1		1	1														1		1								
j_71	Out	0	Max seemed to be trying to force Ted to leave the room, and Walt to stay a little longer.																																	1			1		1	1														1										
j_71	Out	0	Arizona elected Goldwater Senator, and Massachusetts, McCormack.			1													1																																					1		1								
j_71	Out	0	Millie will send the President an obscene telegram, and Paul, the Secretary a rude letter.											1					1																			1																		1		1								
j_71	Out	0	Maytag will give a brand-new dryer to the winner of the Mrs.											1	1	1			1																			1									1																			
j_71	Out	0	Bill didn't eat the peaches, nor Harry.																																		1		1																	1		1								
j_71	Out	1	Bill ate the peaches, and Harry did, too.																																																					1		1								
j_71	Out	0	Bill must quickly eat the peaches, and Harry must slowly.						1				1																									1																		1		1								
j_71	Out	1	Whenever Russia has made a major political blunder, the U.S. has too.						1		1																1												1																		1	1	1							
j_71	Out	1	Bill's story about Sue and Max's about Kathy both amazed me.													1																															1									1		1								
j_71	Out	1	I bought three quarts of wine and two of Clorox.													1																															1									1		1		1	1					
j_71	Out	1	Scientists at the South Hanoi Institute of Technology have succeeded in raising one dog with five legs, another with a cow's liver, and a third with no head.							1		1			1	1																					1		1						1		1		1	1						1		1		1						
j_71	Out	1	Bill's story about Sue may be amazing, but Max's is virtually incredible.		1											1																						1									1									1		1								
j_71	Out	1	I like Bill's yellow shirt, but not Max's.																																		1																			1		1								
j_71	Out	1	Bill's funny story about Sue and Max's boring one about Kathy both amazed me.													1																															1									1		1								
j_71	Out	1	Bill's wine from France and Ted's from California cannot be compared.							1		1								1		1																1	1										1							1		1								
j_71	Out	0	As a teacher, you have to deal simultaneously with the administration's pressure on you to succeed, and the children's to be a nice guy.		1				1						1	1			1																					1	1			1		1	1									1		1	1							
j_71	Out	1	Neither Von Karajan's recording of Beethoven's 6th on Columbia nor Klemperer's on Angel has the right tempo.							1		1				1																					1										1		1							1		1								
j_71	Out	0	Gould's performance of Bach on the piano doesn't please me anywhere as much as Ross's on the harpsichord.						1	1			1			1																					1		1							1												1			1		1			
j_71	Out	0	Tom's dog with one eye attacked Frank's with three legs.							1			1																																				1									1								
j_71	Out	0	Because Steve's of a spider's eye had been stolen, I borrowed Fred's diagram of a snake's fang.													1				1		1																	1								1						1				1	1	1							
j_71	Out	1	Neither von Karajan's recording of Beethoven's 6th on Columbia nor Klemperer's has the right tempo.							1		1				1																					1										1		1							1										
j_71	Out	1	Tom's dog with one eye attacked Fred's.							1			1																																				1									1								
j_71	Out	1	I borrowed Fred's diagram of a snake's eye because Steve's had been stolen.													1				1		1																	1								1										1	1	1							
j_71	Out	1	Jerry attempted to blow up the Pentagon.					1																																	1																									
j_71	Out	1	So fast did he run that nobody could catch him.						1				1												1								1				1	1	1													1	1	1						1			1			
j_71	Out	1	Bill bought a red house, and Max bought one too.																																																					1		1								
s_97	Out	1	Who always drinks milk?						1		1															1																																								
s_97	Out	1	The book which inspired them was very long.		1																								1																				1																	
s_97	Out	0	The book what inspired them was very long.		1																								1																				1																	
s_97	Out	1	I know the person whose mother died.																									1	1																				1																	
s_97	Out	1	The person whose mother's dog we were all fond of.		1											1												1	1																				1		1									1						
s_97	Out	1	I wonder whose mother died.																								1	1																																						
s_97	Out	1	I wonder whose mother's dog died.																								1	1																																						
s_97	Out	1	I wonder to whom they dedicated the building.											1	1				1								1	1																																						
s_97	Out	1	Give me the phone number of the person whose mother's dog died.											1		1			1				1					1	1																		1		1	1																
s_97	Out	1	This is the senator to whose mother's friend's sister's I sent the letter.											1	1				1									1	1																		1		1																	
s_97	Out	0	I want goes to the store.																																						1																								1	1
s_97	Out	0	I wonder what to be a clown on the cover of.		1				1	1		1				1											1			1													1				1																			
s_97	Out	0	Bother you that Kim left!																				1									1																																1		
s_97	Out	0	A student who to talk to us just walked in.					1																					1																1				1																	
s_97	Out	1	Whose bagels do you like?																							1		1											1																											
s_97	Out	1	I wonder in whom to place my trust.											1	1				1								1	1															1																							
s_97	Out	1	There were several old rocks songs that she and I were the only two who knew.															1											1	1						1																				1		1		1						
s_97	Out	0	It was to to amuse us that Kim was singing that they wanted.															1	1													1				1					1												1	1												
s_97	Out	0	What they feared most was to be no one available to help them.		1																						1										1							1		1						1		1						1						
s_97	Out	0	We tried to amuse them that Kim was singing.																1		1											1				1			1		1																							1		
s_97	Out	1	Mary asked me if, in St. Louis, John could rent a house cheap.						1				1						1								1											1															1		1											
s_97	Out	0	Mary arranged for, in St. Louis, John to rent a house cheap.				1																											1																			1													
s_97	Out	1	It would be unwise for there to be no fire exit.		1													1	1		1													1			1																							1						
s_97	Out	1	I believe there to be no way out.													1		1	1	1																	1					1					1													1						
s_97	Out	0	I wonder in whom them to place their trust.												1										1		1	1						1									1																						1	
s_97	Out	0	I wonder whom us to trust.																								1							1																															1	
s_97	Out	0	I wonder who for us to trust.																								1							1																																
s_97	Out	1	I wonder who to place my trust in.											1	1				1								1							1																																
s_97	Out	1	I know the people that voted in the election.						1			1								1									1																				1																	
s_97	Out	1	I threw away a book that Sandy thought we had read.					1											1										1			1			1	1																														
s_97	Out	1	I thought that you were sick.		1																											1																																		
s_97	Out	0	I dislike the people in who we placed our trust.											1	1				1						1			1	1																				1																	
s_97	Out	1	I dislike the company in which we placed our trust.												1										1			1	1																				1																	
s_97	Out	1	I dislike the people in whose house we stayed.																									1	1	1																			1																	
s_97	Out	1	I dislike the person with whom we were talking.												1													1	1										1																											
s_97	Out	0	Jones, that we were talking to last night, always watches football games alone.				1		1		1				1														1										1											1																1
s_97	Out	1	A letter was received that Jones would be upset by.														1					1							1									1	1										1				1													
s_97	Out	0	A letter was received Jones would be upset by.														1			1		1							1						1			1	1														1													
s_97	Out	1	I saw someone yesterday I hadn't seen for years.						1		1																		1						1		1		1										1				1							1		1				
s_97	Out	1	Something happened I couldn't really talk about.												1														1						1																									1						
s_97	Out	1	The only person that I like whose kids Dana is willing to put up with is Pat.		1			1							1				1									1	1											1	1								1																	
s_97	Out	1	The book that I like which everyone else in the class hates was written by John.														1					1							1							1			1										1											1						
s_97	Out	0	The only person whose kids Dana is willing to put up with was written by John.		1			1							1		1		1			1						1	1										1	1				1					1			1												1		
s_97	Out	0	The book that I like - everyone else in the class hates.																										1																				1				1	1						1						
s_97	Out	1	The only person whose kids Dana is willing to put up with is Pat.		1			1							1													1	1											1				1					1			1														
s_97	Out	1	Which book's, author did you meet?																							1		1											1								1																			
s_97	Out	0	Which boy's mother did you meet who you liked?																							1		1	1										1														1													
s_97	Out	0	Which book's, author did you meet who you liked?																							1		1	1																		1						1													
s_97	Out	1	Which boy's mother did you meet?																							1		1											1								1																			
s_97	Out	1	All who lost money in the scam are eligible for the program.		1				1							1													1																				1		1									1						
s_97	Out	0	Who for Sandy to talk to is still enrolled in the class?							1					1											1		1						1									1						1																	
s_97	Out	1	Who who you like does Sandy also like?																							1		1	1										1																											
s_97	Out	1	Everything you like is on the table.		1										1														1						1														1																	
s_97	Out	1	The bills passed by the House yesterday that we objected to were vetoed.						1		1		1		1		1			1		1							1																	1			1				1													
s_97	Out	1	The only people being added to our group who were at Harvard were students.		1									1	1					1		1							1										1																											
swb04	Out	1	We like ourselves.	1																				1																																										
swb04	Out	1	Nobody likes us.																																		1																							1						
swb04	Out	0	Leslie likes ourselves.	1																				1																																									1	
swb04	Out	0	Ourselves like ourselves.	1																				1																																									1	
swb04	Out	1	She voted for herself.												1									1																																										
swb04	Out	0	We gave us presents.											1					1						1																																									
swb04	Out	1	We gave ourselves presents.											1					1					1																																										
swb04	Out	1	We gave presents to ourselves.											1	1				1					1																																										
swb04	Out	0	We gave us to the cause.											1	1				1						1																																								1	
swb04	Out	1	We gave ourselves to the cause.											1	1				1					1																																										
swb04	Out	0	Leslie told us about us.											1	1				1						1																																								1	
swb04	Out	0	Leslie told ourselves about us.											1	1				1					1																																									1	
swb04	Out	1	We think that Leslie likes us.																						1							1																																		
swb04	Out	0	We think that Leslie likes ourselves.																					1								1																																	1	
swb04	Out	1	Our friends like us.	1																					1																																									
swb04	Out	1	Those pictures of us offended us.													1									1																						1																			
swb04	Out	0	We found your letter to ourselves in the trash.			1										1			1					1																							1																		1	
swb04	Out	0	Vote for you!												1								1		1																																								1	
swb04	Out	1	Vote for yourself!												1								1	1																																										
swb04	Out	0	We appeared to them to vote for themselves.												1				1					1																	1																									
swb04	Out	1	We admired the pictures of us in the album.							1		1				1									1																						1		1																	
swb04	Out	1	We admired the pictures of ourselves in the album.							1		1				1								1																							1		1																	
swb04	Out	1	Leslie used a pen.	1																																																														
swb04	Out	1	We put the pigs in a pen.											1	1																																																			
swb04	Out	1	We need to pen the pigs to keep them from getting into the corn.		1				1				1		1				1																					1					1																					
swb04	Out	1	They should pen the letter quickly.						1																													1																												
swb04	Out	1	The car won't run.																																		1	1																												
swb04	Out	1	This dye will run.																																			1																												
swb04	Out	1	She can run an accelerator.																		1																	1																												
swb04	Out	1	These stockings will run.	1																																		1																												
swb04	Out	1	We need another run to win.						1				1																											1			1			1														1						
swb04	Out	1	Lee saw the student with a telescope.			1			1	1			1																																				1																	
swb04	Out	1	I forgot how good beer tastes.		1																						1																																							
swb04	Out	1	Visiting relatives can be boring.		1																																	1							1	1																				
swb04	Out	1	If only Superman would stop flying planes!																																			1							1	1									1											
swb04	Out	1	That's a new car dealership.		1																																													1																
swb04	Out	1	I know you like the back of my hand.						1				1			1									1							1			1												1				1												1			
swb04	Out	1	Max is on the phone now.												1																																																			
swb04	Out	1	I saw her duck.	1																																									1																					
swb04	Out	1	I'm creating a committee. Kim – you're in charge.		1															1																			1								1									1		1								
swb04	Out	1	Lights go out at ten. There will be no talking afterwards.				1	1	1		1							1																																						1										
swb04	Out	1	They found the book on the atom.													1																															1																			
swb04	Out	1	Which experts testified against defendants who exposed them?																																																															
swb04	Out	1	List all experts for the defendant who represented himself.													1							1	1					1																		1		1											1						
swb04	Out	1	List associates of each defendant who speaks Spanish.													1							1						1																		1		1											1						
swb04	Out	0	They lost themselves' books.																					1																																									1	
swb04	Out	1	Some sentences go on and on and on.					1																																																1				1						
swb04	Out	0	Sentences some go on and on and on and on.					1																																													1			1										
swb04	Out	1	That surprised me.	1																																																														
swb04	Out	0	I noticed the.																																																															1
swb04	Out	1	They were interested in his.		1											1																																			1															
swb04	Out	1	This is my favorite.		1																																																					1								
swb04	Out	1	A large dog chased a small cat.	1																																																														
swb04	Out	1	Some people yell at noisy dogs in my neighborhood.							1		1			1																																		1											1						
swb04	Out	1	Some people yell at the dogs in my neighborhood.							1		1			1																																		1											1						
swb04	Out	1	Some people yell at the dogs.												1																																													1						
swb04	Out	1	Some people yell at noisy dogs.												1																																													1						
swb04	Out	1	Some people yell at dogs.												1																																													1						
swb04	Out	1	Some people consider the noisy dogs dangerous.			1													1																																									1						
swb04	Out	1	Some people consider the dogs in my neighborhood dangerous.			1				1		1							1																														1											1						
swb04	Out	1	Some people consider noisy dogs in my neighborhood dangerous.			1				1		1							1																														1											1						
swb04	Out	1	Some people consider the dogs dangerous.			1													1																																									1						
swb04	Out	1	Some people consider noisy dogs dangerous.			1													1																																									1						
swb04	Out	1	Some people consider dogs in my neighborhood dangerous.			1				1		1							1																														1											1						
swb04	Out	1	Some people consider dogs dangerous.			1													1																																									1						
swb04	Out	1	People with children who use drugs should be locked up.					1		1			1							1		1							1									1	1										1																	
swb04	Out	1	This disease gave Leslie a fever in Rome.						1			1		1					1																																															
swb04	Out	1	The love of my life and mother of my children would never do such a thing.						1		1					1																					1	1									1		1							1										
swb04	Out	1	Most elections are quickly forgotten, but the election of 2000, everyone will remember for a long time.						1		1					1																						1									1						1	1						1						
swb04	Out	0	It is painting by Klee or drawing by Miro that the museum displays no.													1		1														1					1										1						1	1						1						1
swb04	Out	1	The defendant denied the accusation.	1																																																														
swb04	Out	0	The teacher disappeared the problem.																		1																																											1		1
swb04	Out	0	The teacher handed the student.																	1																																														1
swb04	Out	1	The bird sings.	1																																																														
swb04	Out	0	The bird sing.	1																																																													1	
swb04	Out	0	Birds sings.	1																																																													1	
swb04	Out	1	The birds give the worm a tug.											1					1																											1																				
swb04	Out	0	The bird give the worm a tug.											1					1																											1																			1	
swb04	Out	0	The birds gives the worm a tug.											1					1																											1																			1	
swb04	Out	1	Terry delighted in my pain.												1																																																			
swb04	Out	0	Terry delighted.																	1																																														1
