Source	In/Out	Accept	Sent	Simple	Copula	Pred/SC	Result/Depictive	Particle	VP Adjunct	NP Adjunct	Temporal	Locative	Misc	Oblique	PP Arg-VP	PPArg-NP/AP	by-Phrase	Expletive	High Arity	Drop Arg	Add Arg	Passive	Imperative	Binding:Refl	Binding:Other	Matrix Q	Emb Q	Complex QP	RC	Island	CP Subj	CP Arg VP	CP Arg NP/AP	Non-finite CP	No C-izer	Deep Embed	Neg	Modal	Aux	Psuedo-Aux	Control	Raising	VP+Extract	VP arg-NP/AP	Non-finite VP Misc	Deverbal 	Rel NP	Trans NP	Compx NP	NNCompd	Rel Adj	Trans Adj	Dislocation	Info Struc	Frag/Paren	Coord	Subordinate/Cond	Ellipsis/Anaphor	S-Adjunct	Quantifier	Partitive	NPI/FCI	Comparative	Sem  Violation	Infl/Agr Violation	Extra/Mising Expr
sgww85	In	1	Pat was awarded the Golden Fleece Award and very upset about it.		1										1	1				1		1																													1															
sgww85	In	0	Kim alienated cats and beating his dog.																						1																															1									1	
sgww85	In	1	They knew that pictures of each other would be on sale.												1	1								1								1						1									1																			
sgww85	In	0	Which article did Terry file papers without reading?						1				1													1		1		1															1																					
sgww85	In	1	I want to try and buy some whiskey.																																	1					1				1											1				1						
sgww85	In	0	She goes and buying some whiskey.																																																					1				1					1	
sgww85	In	0	Kim and Terry is happy.		1																																																			1									1	
sgww85	In	1	Kim gave a dollar to Bobbie and a dime to Jean.											1	1				1																																					1										
sks13	In	1	This girl in the red coat will put a picture of Bill in the mailbox and on your desk before tomorrow.						1	1	1	1		1	1	1			1																			1									1		1							1										
sks13	In	0	Put a picture of Bill on your desk before tomorrow, this girl in the red coat will put a picture of Bill on your desk before tomorrow.						1	1	1	1		1	1	1			1																			1									1		1				1	1												
sks13	In	0	Picture of Bill, this girl in the red coat will put a picture of Bill on your desk before tomorrow.						1	1	1		1	1	1	1			1																												1		1				1	1												
sks13	In	1	Ann bought a first edition of Richard III for $1000.											1	1	1			1																												1																			
sks13	In	1	John became deadly afraid of flying.		1											1																													1	1					1															
sks13	In	1	What John promised is to be gentle.		1																						1														1					1								1												
sks13	In	1	Henri wants to buy which books about cooking?													1										1		1													1					1	1																			
sks13	In	1	I will fix the computer for Carol.						1				1																									1																												
sks13	In	1	Smith loaned a valuable collection of manuscripts to the library.											1	1	1			1																												1																			
sks13	In	1	The paper is cut by Mary.														1					1																	1																											
sks13	In	1	It was from six to nine or it took place from six to nine.		1				1		1																																													1										
sks13	In	1	Suddenly, there arrived two inspectors from the INS.						1	1		1						1			1																												1				1						1							
sks13	In	1	The soup cooks, thickens.																																																				1	1										
sks13	In	1	I gave money to the charity.											1	1				1																																															
sks13	In	1	John asked.																	1																																														
sks13	In	1	I saw even the student.							1																																																								
sks13	In	0	John whispered Mary left.																													1			1																															
sks13	In	0	Mary wonders that Bill will come.																													1						1																												
sks13	In	0	Sophie will theater.	1																																		1																										1		
sks13	In	1	John finished the cake and drank the lemonade.																																																					1										
sks13	In	0	Herself likes Mary's mother.	1																				1																																									1	
sks13	In	1	Each of the boys fought with some of the other boys.												1																																													1	1					
sks13	In	0	John's mother likes himself.																						1																						1																		1	
sks13	In	0	Mary revealed himself to John.											1	1				1					1																																									1	
sks13	In	1	Mary believes that Bill saw himself.																					1								1																																		
sks13	In	0	John heard that they criticized themselves.																					1								1																																		
sks13	In	1	Mary thinks that she is smart.		1																											1																																		
sks13	In	1	Henry found that Bill is sad.		1																											1																																		
sks13	In	1	John considers himself proud of Mary.			1										1			1					1																											1															
sks13	In	0	You should sit before there.						1			1																										1																												
sks13	In	1	There is a nurse available.		1													1	1		1																																													
sks13	In	0	Everyone hopes everyone to sleep.																1		1																				1																			1						1
sks13	In	1	Everyone hopes that he will sleep.																						1							1						1																						1						
sks13	In	0	Only Churchill remembered Churchill giving the Blood, Sweat and Tears speech.			1													1						1							1		1	1										1					1						1										
sks13	In	1	John promise Mary to shave himself.																1					1																	1																									
sks13	In	1	John convinced Bill that Mary should sleep.																1													1							1																											
sks13	In	0	I saw Bill while you did so Mary.																																				1																		1	1	1							
sks13	In	0	What Mary did Bill was give a book.		1																						1												1						1	1								1				1								1
ad03	In	1	The bears sniffed																	1																																														
ad03	In	1	to steal talismans from witches is dangerous		1									1	1																														1	1																				
ad03	In	0	Anson demonized																	1																																														1
ad03	In	1	You kicked yourselves	1																				1																																										
ad03	In	1	The book that I said that I'd never read.																										1			1				1	1	1											1																	
ad03	In	0	Anson demonized up the Khyber						1			1																																																				1		
ad03	In	1	It is not true that I might be going to the party.		1													1	1		1											1					1	1	1																											
ad03	In	0	Kick you!																				1		1																																								1	
ad03	In	1	Jason persuaded the doctor to treat Medea																1																						1																									
ad03	In	1	Who did you get an accurate description of?													1										1				1									1							1	1																			
ad03	In	1	The Peter we all like was at the party												1														1						1														1											1						
ad03	In	1	The government's imposition of a fine.													1																														1	1																			
ad03	In	1	Did Athena help us?																							1																																								
ad03	In	1	You wanted to meet the man I saw.																										1						1						1								1																	
ad03	In	1	Anson demonized David every day						1		1																																																	1						
ad03	In	1	There is a programme about Euripides on a Radio 4 tonight?		1				1		1				1			1	1		1																																													
ad03	In	1	Medea denied poisoning the phoenix.																																										1																					
ad03	In	1	The elixir was hidden in a hole in the ground						1	1		1								1		1																											1																	
ad03	In	1	Extremely frantically, Anson danced at Trade						1			1																																									1													
ad03	In	0	What did you ask who Medea gave?											1					1							1	1			1									1																											
ad03	In	1	It's Anson that I like															1	1		1								1			1																						1												
ad03	In	0	Medea tried the nurse to poison her children.																1		1				1																1																									
ad03	In	1	I felt that I know you.																													1																																		
ad03	In	0	Will he can do it?																							1												1																												1
ad03	In	0	I ate that she was happy		1																											1																																1		
ad03	In	1	Anson believed himself to be handsome.		1														1					1																		1																								
ad03	In	1	We arrived about six o'clock						1		1																																																							
ad03	In	0	Gilgamesh is having fought the dragon.																																				1																										1	
ad03	In	0	Anson thought that himself was happy.		1																			1								1																																		
ad03	In	1	Fortunately Hermione passed biology																																																								1							
ad03	In	1	I might be not going to the party but washing my hair												1										1												1	1	1																		1									
ad03	In	0	I thought he liked myself																					1								1			1																														1	
ad03	In	1	The butler sent the poison to Dinah.											1	1				1																																															
ad03	In	1	Jason happens to appear to seem to be sick.		1																															1						1																								
ad03	In	0	What did you ask who saw?																							1	1			1									1																											
ad03	In	1	We linguists love to argue																																						1																			1						
ad03	In	0	He can will go																																			1																												1
ad03	In	0	How fierce the battle?		1																																																													1
ad03	In	0	Which king did you ask which city invaded?																	1						1	1	1		1																																				1
ad03	In	1	It is some disgruntled old pigs in those ditches that humans love to eat.							1		1						1	1		1											1				1					1								1					1						1						
ad03	In	1	That banana is eating the monkey.																																				1																											
ad03	In	1	Burn them!																				1																																											
ad03	In	1	It stinks that Aphrodite is omnipotent.															1			1											1																																		
ad03	In	1	Agamemnon seems to be a maniac		1																																					1																								
ad03	In	1	Will Anson come to the party?												1											1												1																												
ad03	In	1	I wondered who Medea had poisoned.																								1												1																											
ad03	In	0	I inquired when could we leave.						1		1																1											1																												1
ad03	In	1	They kicked them	1																					1																																									
ad03	In	0	The monkey is ate the banana																																				1																										1	1
ad03	In	0	I would like to could swim																																			1			1																								1	
ad03	In	1	I kicked myself	1																				1																																										
ad03	In	0	The bookcase ran	1																																																												1		
ad03	In	1	I shaved myself.																		1			1																																										
ad03	In	0	Anson became a muscle bound.		1																																																													1
clc95	Out	1	Somebody just left - guess who.																				1				1																													1		1								
clc95	Out	1	They claimed they had settled on something, but it wasn't clear what they had settled on.												1			1			1						1					1			1		1		1													1														
clc95	Out	1	If Sam was going, Sally would know where.																	1							1												1																		1	1								
clc95	Out	1	They're going to serve the guests something, but it's unclear what.											1				1	1		1						1						1							1	1											1				1		1		1						
clc95	Out	1	She's reading. I can't imagine what.																	1							1										1	1	1																	1		1								
clc95	Out	1	John said Joan saw someone from her graduating class.							1		1													1							1			1														1											1						
clc95	Out	0	John ate dinner but I don't know who.																								1												1																	1		1								
clc95	Out	0	She mailed John a letter, but I don't know to whom.											1	1				1								1	1																												1		1								
clc95	Out	1	I served leek soup to my guests.																																															1																
clc95	Out	1	I served my guests.																	1																																														
clc95	Out	0	She was bathing, but I couldn't make out who.					1												1							1										1	1	1																	1		1								
clc95	Out	0	She knew French for Tom.											1	1				1		1																																													
clc95	Out	0	John is tall on several occasions.						1		1																																																					1		
clc95	Out	0	The ship sank, but I don't know with what.						1				1														1	1																												1		1								
clc95	Out	0	They noticed the painting, but I don't know for how long.						1		1																1	1									1		1																	1		1						1		
clc95	Out	0	John was tall, but I don't know on what occasions.		1				1		1																1	1									1		1																	1		1								
clc95	Out	1	Joan ate dinner with someone but I don't know who.						1				1														1																													1		1		1						
clc95	Out	1	Joan ate dinner with someone but I don't know who with.						1				1														1	1																												1		1		1						
clc95	Out	0	I know that Meg's attracted to Harry, but they don't know who.		1										1	1											1					1																			1					1		1								
clc95	Out	0	Since Jill said Joe had invited Sue, we didn't have to ask who.																								1					1			1		1		1	1	1																1	1	1							
clc95	Out	1	I know that Meg's attracted to Harry, but they don't know who.		1										1	1											1					1																			1					1		1								
clc95	Out	0	She said she had spoken to everybody, but he wasn't sure who.												1												1					1	1		1				1													1				1		1								
clc95	Out	0	Each of the performers came in, but were sitting so far back that we couldn't see who.					1																				1					1				1	1	1													1						1		1	1		1			1
clc95	Out	1	She didn't talk to one student.												1																						1		1																					1						
clc95	Out	0	She doesn't meet anyone for dinner, but they can't figure out who.					1																			1										1	1																		1		1				1				
clc95	Out	1	Everyone relies on someone. It's unclear who.		1										1			1			1						1						1																			1				1										
clc95	Out	1	Each student wrote a paper on a Mayan language, but I don't remember which one.													1											1										1										1									1		1		1						
clc95	Out	1	The newspaper has reported that they are about to appoint someone, but I can't remember who the newspaper has reported that they are about to appoint.																								1			1		1				1	1	1		1	1															1				1						
clc95	Out	1	The newspaper has reported that they are about to appoint someone, but I can't remember who they are about to appoint.												1												1					1					1	1	1	1				1												1										
clc95	Out	1	Most columnists claim that a senior White House official has been briefing them, and the newspaper today reveals which one.						1		1													1								1				1			1											1						1		1		1						
clc95	Out	1	Most columnists claim that a senior White House official has been briefing them, but none will reveal which one.																						1		1	1				1					1	1	1																	1		1		1						
clc95	Out	1	Bill wondered how many papers Sandy had read, but he didn't care which ones.																								1	1									1		1																			1								
clc95	Out	1	I never know which papers Sandy has read, but I usually know how many.																								1	1											1																	1		1	1							
clc95	Out	1	Sandy had read how many papers?!																							1													1																					1						
clc95	Out	1	Everybody gets on well with a certain relative, but often only his therapist knows which one.					1							1				1						1		1	1																												1		1								
clc95	Out	1	Which book did each author recommend?																							1		1											1																					1						
clc95	Out	1	His or her least known work.																	1		1																								1			1							1										
clc95	Out	1	They were going to meet sometime on Sunday, but the faculty didn't know when.						1	1	1																1										1		1										1							1				1						
clc95	Out	1	John likes some students, but I don't know who.																								1										1		1																	1		1		1						
clc95	Out	1	I don't know who John likes.																								1										1		1																											
clc95	Out	0	John likes some students, but I don't know who John likes some students.																1		1						1																													1										1
clc95	Out	0	Joan said she talked to the students, but Fred couldn't figure out who.					1							1												1					1			1		1	1																		1		1								
clc95	Out	0	He announced he had eaten the asparagus, but we didn't know what.																								1					1			1		1		1																	1		1						1		
clc95	Out	1	She was reading the books under the table, but Fred didn't know what books.						1	1		1															1	1									1												1							1		1								
clc95	Out	1	He announced he would marry the woman he loved most, but none of his relatives could figure out who.					1																			1		1			1			1	1	1	1																		1		1		1	1					
clc95	Out	1	She talked to John or Mary but I don't know which.												1												1										1		1																	1		1								
clc95	Out	1	She talked to John or Mary but I don't know which one.												1												1	1									1																			1		1								
clc95	Out	1	She talked to Harry, but I don't know who else.												1												1	1									1		1																	1		1								
clc95	Out	1	I will see them, but I don't know how many of them.																								1	1										1																		1		1		1	1					
clc95	Out	1	Everyone who knows either Susan or Laura likes her.																						1				1																				1							1				1						
clc95	Out	0	She said she talked to three students but I don't know how many.												1												1	1				1			1		1		1																	1		1		1						
clc95	Out	0	She said she talked to those students but I don't know how many.												1												1	1				1			1		1		1																	1		1		1						
clc95	Out	1	He shouted again, but I don't know who to.						1		1				1					1							1										1		1																	1		1								
clc95	Out	1	She was dancing with somebody, but I don't know who with.						1				1														1	1									1		1																	1		1								
clc95	Out	1	Several firefighters were injured, but it's not known.																	1		1																																		1				1						
clc95	Out	1	Meg is attracted to Harry, but they don't know who she is attracted to.		1											1											1										1		1												1					1										
clc95	Out	1	Sandy was trying to work out which students would be able to solve a certain problem, but she wouldn't tell us which one.		1			1											1								1	1										1			1															1		1		1						
clc95	Out	0	Sandy was trying to work out which students would be able to solve a certain problem, but she wouldn't tell us which one she was trying to work out which students would be able to solve.					1	1																		1											1	1	1	1															1		1		1						
clc95	Out	0	John and someone were dancing together, but I don't know who.						1				1														1										1		1																	1		1		1						
clc95	Out	1	The TA's have been arguing about whether some student or other should pass, but I can't now remember which one.												1												1										1	1	1																	1		1								
clc95	Out	0	It has been determined that somebody will be appointed; it's just not clear yet who.		1													1		1	1	1					1					1					1		1													1				1				1		1				
clc95	Out	0	Sally asked if somebody was going to fail math class, but I can't remember who.																								1										1	1	1	1	1															1		1		1						
clc95	Out	0	The TA's have been arguing about whether some student or other should pass, but I can't now remember which one.												1												1										1	1	1																	1		1		1						
clc95	Out	1	Sandy is very anxious to see if the students will be able to solve the homework problem in a particular way, but she won't tell us which.		1				1				1						1								1										1	1			1			1						1		1				1		1								
clc95	Out	1	Sandy is very anxious to see if the students will be able to solve the homework problem in a particular way, but she won't tell us in which way.		1				1				1						1								1	1								1		1		1	1			1						1		1				1		1								
clc95	Out	1	Clinton is anxious to find out which budget dilemmas Panetta would be willing to tackle in a certain way, but he won't say in which.		1			1	1				1						1								1	1								1	1	1		1	1			1						1		1				1		1								
clc95	Out	1	Sandy is wondering whether there will be students who have to drop the class for a certain reason, but she won't reveal what.						1				1					1									1		1								1	1		1	1															1		1								
clc95	Out	0	In which way is Sandy very anxious to see if the students will be able to solve the homework problem?		1																					1	1	1								1		1		1	1			1								1														
clc95	Out	0	In which way is Clinton anxious to find out which budget dilemmas Panetta would be willing to solve?		1				1				1													1	1	1		1						1		1		1	1			1								1														
clc95	Out	1	I know how many assignments I've graded, but I don't know how many Bill has.																								1	1											1																	1		1		1						
clc95	Out	0	What did you leave before they did?																							1				1									1																		1		1							
clc95	Out	0	What did you leave before they started playing?																							1				1																											1		1							
clc95	Out	1	Sandy was trying to work out which students would be able to solve a certain problem.		1																							1								1			1	1	1																			1						
clc95	Out	1	The administration has issued a statement that it is willing to meet with one of the student groups.		1										1										1								1						1	1	1							1												1	1					
clc95	Out	1	Sandy was trying to work out which students would be able to solve a problem.		1			1											1								1	1								1		1		1	1																									
clc95	Out	1	The administration has issued a statement that it is willing to meet a student group.		1																				1								1						1	1	1							1		1																
clc95	Out	1	The administration has issued a statement that it is willing to meet a student group, but I'm not sure which one.		1																				1		1	1					1				1			1				1				1				1				1		1								
clc95	Out	1	I think Agnes said that Bill would speak, but I don't remember what about.												1					1							1					1			1		1	1	1																	1		1								
clc95	Out	0	Agnes wondered how John could eat but it's not clear what.						1				1					1		1	1						1										1	1														1				1		1								
clc95	Out	0	Tony sent Mo a picture that he painted, but it's not clear with what.		1				1				1	1					1								1	1	1																				1			1				1		1								
clc95	Out	1	She's been dancing but we don't know with whom.						1				1														1	1									1		1																	1		1								
clc95	Out	0	Who did they see someone?																		1					1													1																					1						1
c-05	Out	1	It was believed by everybody that Mary was a thief.		1												1	1	1		1	1										1																												1						
c-05	Out	1	That professor is feared by all students.														1					1																	1																											
c-05	Out	1	Mary was respected by John.														1					1																																												
c-05	Out	1	Ted was bitten by the spider.														1					1																	1																											
c-05	Out	0	The book was by John written.														1					1																															1													
c-05	Out	0	The argument was summed by the coach up.					1									1		1			1																															1													
c-05	Out	1	The paper was written up by John.					1									1		1			1																																												
c-05	Out	0	The paper was written by John up.					1									1		1			1																																												
c-05	Out	1	John was spoken to by Mary.												1		1					1																	1																											
c-05	Out	0	John was spoken by Mary to.												1		1					1																	1														1													
c-05	Out	1	The book was seen by Mary.														1					1																	1																											
