Source	In/Out	Accept	Sent	Simple	Copula	Pred/SC	Result/Depictive	Particle	VP Adjunct	NP Adjunct	Temporal	Locative	Misc	Oblique	PP Arg-VP	PPArg-NP/AP	by-Phrase	Expletive	High Arity	Drop Arg	Add Arg	Passive	Imperative	Binding:Refl	Binding:Other	Matrix Q	Emb Q	Complex QP	RC	Island	CP Subj	CP Arg VP	CP Arg NP/AP	Non-finite CP	No C-izer	Deep Embed	Neg	Modal	Aux	Psuedo-Aux	Control	Raising	VP+Extract	VP arg-NP/AP	Non-finite VP Misc	Deverbal 	Rel NP	Trans NP	Compx NP	NNCompd	Rel Adj	Trans Adj	Dislocation	Info Struc	Frag/Paren	Coord	Subordinate/Cond	Ellipsis/Anaphor	S-Adjunct	Quantifier	Partitive	NPI/FCI	Comparative	Sem  Violation	Infl/Agr Violation	Extra/Mising Expr
l-93	In	1	The voices echoed in the hall.						1			1																																																						
l-93	In	1	The stream twists through the valley.						1			1																																																						
l-93	In	0	There presented itself a wonderful opportunity yesterday.						1		1							1			1			1																																										
l-93	In	1	A wonderful opportunity presented itself to him yesterday.						1		1								1					1																																										
l-93	In	1	Out of the box jumped a little white rabbit.												1																																						1	1												
l-93	In	1	Penny skated around the rink.						1			1																																																						
l-93	In	1	Jackie accompanied Rose.																	1																																														
ks08	In	0	many information was provided.																	1		1																	1																					1				1	1	
ks08	In	0	John offers many advice.																	1																																								1				1	1	
ks08	In	1	The cake that Jones got was more delicious than the one that Smith got.		1											1													1																				1		1							1					1			
ks08	In	1	We recommend to eat less cake and pastry.																																						1															1							1			
ks08	In	1	I saw that gas can explode.			1													1													1						1							1					1																
ks08	In	1	He washed her.	1																																																														
ks08	In	0	Wash you!	1																			1		1																																								1	
ks08	In	0	They have no in.																																		1																							1				1		1
ks08	In	0	Some my jobs are in jeopardy.		1																																																							1	1					1
ks08	In	0	It was the policeman met that several young students in the park last night.						1		1	1						1														1																					1	1												
ks08	In	1	did the policeman meet in the park?						1			1														1													1																											
ks08	In	1	John put old books in the box.											1	1				1																																															
ks08	In	0	The monkeys proud of their leader.			1										1									1																										1															1
ks08	In	0	John sounded very.	1	1																																																													1
ks08	In	1	I don't know if I should agree.																								1										1	1	1																											
ks08	In	1	John bought a book on the table.						1	1		1																																					1																	
ks08	In	1	John called the president a fool.			1													1																																															
ks08	In	1	I forgot how good beer tastes.		1				1				1														1	1																																						
ks08	In	1	This teacher is a genius.		1																																																													
ks08	In	0	A good friend is remained to me by him.											1	1		1		1		1	1																	1																											
ks08	In	1	John ate his noodle quietly.																						1																																									
ks08	In	1	A smith hammered the metal.	1																																																														
ks08	In	1	Sandy removed her ballet shoes.	1																					1																																									
ks08	In	1	This week will be a difficult one for us.		1											1																						1													1															
ks08	In	1	Benny worked in a shoe factory when he was a student.		1				1			1																																						1							1									
ks08	In	1	Everyone hoped that she would sing.																						1							1						1																						1						
ks08	In	1	This proved a decisive factor.		1																																																													
ks08	In	1	The crocodile devoured the doughnut.	1																																																														
ks08	In	1	John is afraid of Bill.		1											1																																			1															
ks08	In	0	John put under the bathtub.												1					1																																														1
ks08	In	1	John placed Kim behind the garage.											1	1				1																																															
ks08	In	0	Kim depends for Sandy.												1																																																			
ks08	In	1	John put the book in the box.											1	1				1																																															
ks08	In	1	John taught English Syntax to new students.											1	1				1																																															
ks08	In	1	John regards Bill as a good friend.			1									1				1																																															
ks08	In	0	Kim put in the box.												1					1																																														1
ks08	In	1	The chickens seem fond of the farmer.		1											1																																			1															
ks08	In	1	The rules require that the executives be polite.		1																											1		1																																
ks08	In	0	That Fred was unpopular nominated Bill.		1																										1																																	1		
ks08	In	1	They were taking a hard look at possible FTA.													1																							1							1	1																			
ks08	In	0	John paid me against the book.											1	1				1																																															
ks08	In	1	The committee will study the feasibility of setting up a national computer network.					1								1																						1								1	1			1																
ks08	In	1	We made them be rude.		1														1																										1																					
ks08	In	1	After reading the pamphlet, Judy threw it into the garbage can.											1	1				1						1																				1					1									1							
ks08	In	0	Students studying English reads Conrad's Heart of Darkness while at university.						1	1	1	1	1																																1				1																1	
ks08	In	1	I read some of the book.																																																									1	1					
ks08	In	1	Most of the fruit is rotten.		1																																																							1	1					
ks08	In	0	Neither of students failed.																																																									1	1					1
ks08	In	0	I drank some of water.																																																									1	1					1
ks08	In	1	It is a golden hair.	1	1																																																													
ks08	In	1	The boy in the doorway waved to his father.							1		1			1										1																								1																	
ks08	In	1	That dog is so ferocious, it even tried to bite itself.		1																			1									1		1						1											1														
ks08	In	0	He washed yourself.	1																				1																																									1	
ks08	In	0	John is easy to please Kim.		1																1																							1								1														1
ks08	In	0	There seemed to be intelligent.	1														1		1																						1																								
ks08	In	1	John tried to please Stephen.																																						1																									
ks08	In	0	We believed John to be a fountain in the park.		1					1		1							1																							1							1															1		
ks08	In	0	It tries to leave the country.															1																							1																							1		
ks08	In	1	John tries to leave the country.																																						1																									
ks08	In	1	Under the bed seems to be a fun place to hide.		1																															1						1	1	1								1														
ks08	In	0	There is believed to be sheep in the park.		1													1		1	1	1																	1			1																							1	
ks08	In	0	I hope to would study in France.						1			1																										1			1																								1	1
ks08	In	1	John can kick the ball.																																			1																												
ks08	In	0	John will rain tomorrow.						1		1																											1																										1		
ks08	In	0	We expect there to will rain.															1	1																			1				1																							1	1
ks08	In	1	John was found in the office.			1									1					1		1																																												
ks08	In	0	Did the child be in the school?		1										1											1													1																											1
ks08	In	1	It did not rain.															1																			1		1																											
ks08	In	1	John wants not to leave the town.																																		1				1																									
ks08	In	1	Mary likes to tour art galleries, but Bill hates to.																																						1															1		1								
ks08	In	1	They needn't take this exam.																																		1	1																												
ks08	In	1	Ann may spend her vacation in Italy.											1	1				1																			1																												
ks08	In	1	They love to play golf, but I do not.																																		1		1		1															1		1								
ks08	In	1	George has spent a lot of money, hasn't he?																							1													1																1			1		1	1					
ks08	In	1	As a statesman, scarcely could he do anything worth mentioning.			1				1																												1					1	1					1			1	1						1	1		1				
ks08	In	1	We never found any of the unicorns.																																		1																								1	1				
ks08	In	1	One of Korea's most famous poets wrote these lines.																																																									1	1					
ks08	In	1	Somebody apparently struck the unidentified victim during the early morning hours.						1		1																																							1									1	1						
ks08	In	1	The car was driven.																	1		1																	1																											
ks08	In	1	Ricky can be relied on.																	1		1																1	1																											
ks08	In	1	The bed was slept in.						1			1								1		1																																												
ks08	In	0	A pound was weighed by the book.		1												1				1	1																	1																											
ks08	In	1	Who do you think Tom saw?																							1						1			1				1																											
ks08	In	1	he had spent five thousand dollars.																																				1																					1						
ks08	In	0	Fed knows which politician her to vote for.												1												1							1									1																							
ks08	In	1	How did you guess that he fixed the computer?						1				1													1						1							1																											
ks08	In	1	The committee knows whose efforts to achieve peace the world should honor.																								1	1								1		1			1			1				1																		
ks08	In	0	Which house does your friend live?																							1		1											1																											1
ks08	In	1	the baker from whom I bought these bagels left.											1	1				1									1	1																				1																	
ks08	In	1	I found the place where we can relax.						1			1																	1									1											1																	
ks08	In	0	Jack is the person with whom Jenny fell in love with.		1									1	1				1									1	1																				1																	1
ks08	In	1	There is a bench to sit on.															1			1																						1																							
ks08	In	1	I met the man who grows peaches.																										1																				1																	
ks08	In	1	Which topic did you choose without getting his approval?						1				1													1		1		1																																				
ks08	In	0	Which topic did you get bored because Mary talked about?		1										1											1		1		1																											1									
ks08	In	1	That is the reason why he resigned.		1																						1						1															1																		
ks08	In	1	It bothers me that John coughs.															1	1													1																																		
ks08	In	1	To please John is easy.		1																																								1	1																				
ks08	In	1	Kim is eager to please Tom.		1																																							1								1														
ks08	In	1	That we invaded Iraq really bites.																												1																																			
ks08	In	1	It annoys me that Fido barks.															1	1		1											1																																		
ks08	In	0	Who achieved the best result was Angela.		1																						1																											1												
ks08	In	1	It was the peasant girl who got it.		1													1	1		1						1																							1				1												
ks08	In	1	That kind of person is hard to find anyone to look after.		1					1			1		1	1																				1							1	1			1		1			1										1				
kl93	In	1	A sick owl doesn't hunt mice.																																		1		1																							1				
kl93	In	1	Each candidate who has interest in semantics will be admitted to the department.												1	1				1		1							1																		1													1						
kl93	In	1	Each author whose contribution is written in any language other than English will provide a summary in English.						1	1			1			1				1		1						1	1									1	1										1		1									1		1				
kl93	In	1	I'm sure we even got these tickets!		1																												1		1																	1														
kl93	In	1	I'm even sure we got these tickets!		1																												1	1																												1				
kl93	In	1	It's not because I have any sympathy for urban guerillas that I helped him.													1		1														1					1										1							1			1		1			1				
kl93	In	1	It isn't because Sue said anything bad about me that I'm angry.		1				1				1					1	1		1											1					1																				1		1							
b_82	In	0	That he was hungry, John whined.		1																											1																					1	1												
b_82	In	0	1 gave Mary after the party a book.						1		1			1					1																																		1													
b_82	In	0	Because she's so pleasant, as for Mary I really like her.		1																				1																												1	1			1		1							
b_82	In	1	Though he may hate those that criticize Carter, it doesn't matter.															1			1								1								1	1	1										1								1	1								
b_82	In	1	With no job would John be happy.		1																																1	1															1	1						1						
b_73	In	1	I have much of the manuscript left to type.			1																																					1	1								1								1	1					
b_73	In	1	He's a more reliable man.		1																																																										1			
b_73	In	0	Any trouble is what I don't want.		1																						1										1		1														1	1								1				
b_73	In	1	They may grow as high as bamboo.				1																															1																									1			
b_73	In	1	Some of them made as many errors as 20.																																																		1							1	1		1			
c_13	In	0	Sally kissed himself.	1																				1																																									1	
c_13	In	1	Drew believes I think Rosie loves magazine ads.																													1			1	1														1																
c_13	In	1	Dave, Dan, Erin, Jaime, and Alina left.																																																					1										
c_13	In	1	Hopefully, we'll make it through the winter without snow.						1				1		1			1																				1															1						1							
c_13	In	0	Blue leather shows herself that Betsy is pretty.		1														1					1								1																																	1	
c_13	In	1	Gwen hit the baseball.	1																																																														
c_13	In	0	I hit that you knew the answer.																													1																																1		
c_13	In	1	I've lost my wallet or I've lost my mind.																						1														1																	1										
c_13	In	1	It was a brand new car that he bought.															1														1																						1												
c_13	In	1	He likes cookies and he hates crumb cake.																																																					1										
c_13	In	1	They chased the man with the car.						1	1			1																																				1																	
c_13	In	1	I didn't have a red cent.																																		1		1																							1				
c_13	In	0	the book of poems and from Blackwell takes a very long time to read.							1			1			1			1																								1				1		1							1										
c_13	In	1	the one with a red cover takes a very long time to read.						1	1			1						1																								1						1									1								
c_13	In	1	John has a fear of dogs.													1																														1	1																			
c_13	In	0	The building's the roof is leaking.																																				1								1																			1
c_13	In	0	the panther's the coat is dark black.		1																																																													1
c_13	In	1	Colin asked if they could get a mortgage.																								1											1																												
c_13	In	1	The man I saw get into the cab robbed the bank.												1				1										1																1				1																	
c_13	In	1	I know you eat asparagus.																													1			1																															
c_13	In	1	John's drum will always bother me.						1		1																											1																												
c_13	In	1	An evil thought struck Dave.	1																																																														
c_13	In	1	In the classroom John put the book on the table.									1		1	1				1																																		1						1							
c_13	In	1	Phillip gave the medal to the soldier.											1	1				1																																															
c_13	In	0	Heidi thinks that Andy to eat salmon flavored candy bars.																													1		1															1																	
c_13	In	1	Heidi thinks that Andy should eat salmon flavored candy bars.																													1						1																												
c_13	In	1	He danced.	1																																																														
c_13	In	0	Did Calvin his homework?																							1													1																											1
c_13	In	1	Sylvia was slapping Jeff upside the head in martial arts class.						1			1																											1											1																
c_13	In	0	If I am a rich man, I'd buy a diamond ring.		1																																	1												1							1								1	
c_13	In	1	If he were a rich man, he'd buy a diamond ring.		1																																	1												1							1									
c_13	In	1	John is likely to leave.		1																																					1		1								1														
c_13	In	1	The manager laughed.	1																																																														
c_13	In	0	Was sunk.																	1		1																	1																											1
c_13	In	1	Who did you think kissed the gorilla?																							1						1			1				1																											
c_13	In	1	Have you seen my model airplane collection?																							1													1											1																
c_13	In	1	It seems that Lucy was mugged.															1														1																																		
c_13	In	1	I ate a salad that was filled with lima beans.											1	1					1		1							1										1										1	1																
c_13	In	1	There were four men arriving at the station when I pulled up.					1	1			1						1	1	1	1																		1																				1							
c_13	In	1	Jean is reluctant to dance.		1																																							1								1														
c_13	In	1	I want her to dance.																1																						1																									
c_13	In	1	Jean persuaded Robert.																	1																																														
c_13	In	1	Jean wants Bill to do the Macarena.																1																						1																									
c_13	In	1	The children admire their mother.																						1																						1																			
c_13	In	1	Who has Peter talked with?												1											1													1																											
c_13	In	1	Heidi likes her violin.	1																					1																																									
c_13	In	0	John thinks that Mary loves himself.																					1								1																																	1	
c_13	In	1	Which pictures of himself does John like?													1								1		1		1											1								1																			
d_98	In	1	Any owl hunts mice.																																																											1				
d_98	In	0	Any man didn't eat dinner.																																		1		1																							1		1		
d_98	In	1	A pilot could be flying this plane.																																			1	1																											
d_98	In	1	Everybody who attended last week's huge rally, whoever they were, signed the petition.																								1		1																				1						1					1		1				
d_98	In	1	Anybody who attended last week's huge rally signed the petition.																										1																				1													1				
d_98	In	1	Any tiger has orange fur, marked with black stripes.							1			1		1					1		1																								1			1													1				
d_98	In	1	Any albino tiger has orange fur, marked with black stripes.													1																														1					1											1				
d_98	In	1	You must pick any flower you see.																										1						1			1																								1				
d_98	In	1	Any pilot on duty today could be flying this plane.							1			1																									1	1										1													1				
d_98	In	0	You may pick every flower, but leave a few for Mary.											1	1				1				1															1																		1		1		1						
g_81	In	1	The Dodgers beat the Red Sox and were beaten by the Giants.														1					1																	1																											
g_81	In	1	In which car was the man seen?				1								1					1		1				1		1																																						
g_81	In	1	The man who Mary loves and Sally hates computed my tax.																										1	1																			1							1										
g_81	In	0	The kennel which Mary made and Fido sleeps has been stolen.									1								1	1	1							1	1																										1										1
g_81	In	1	Tom said he would and Bill actually did eat a raw eggplant.																													1			1			1	1																											
m_02	In	1	The wealthy young man bought that piano for his secret fiancée.						1				1												1																																									
m_02	In	1	The dog stole the turkey.	1																																																														
m_02	In	1	a tall building.																																																				1											
m_02	In	1	This building is tall.	1	1																																																													
m_02	In	1	I like the book which you gave me.																										1																				1																	
m_02	In	1	Captain Wentworth wrote a letter to Anne Elliott.											1	1				1																																															
m_02	In	1	She asked was Alison coming to the party.												1												1								1				1																											
m_02	In	1	They realised that never had Sir Thomas been so offended.		1				1		1																					1					1		1														1	1												
m_02	In	1	Fanny regretted having to talk to Aunt Norris.												1																									1					1																					
m_02	In	1	Knowing the country well, he took a short cut.																																										1														1							
m_02	In	1	He left the train with somebody else's wallet in his pocket.				1		1				1												1																																			1						
m_02	In	1	Magnus went to Ireland.												1																																																			
m_02	In	1	Who did John send the book?											1					1							1																																								
m_02	In	1	The idea dismayed the Prime Minister that the Dome was dull.		1																												1															1																		
m_02	In	1	Came right in he did without so much as a knock.						1																														1														1	1						1						
m_02	In	1	Harriet admired Mr Knightley.	1																																																														
m_02	In	1	The book is boring.	1	1																																																													
m_02	In	1	Ethel wishes to ask you some awkward questions.																																						1																			1						
m_02	In	1	Emma made Harriet some food.											1					1		1																																													
m_02	In	1	The window was broken with a hammer.						1				1							1		1																																												
m_02	In	1	The fugitive lay motionless in order to avoid discovery.				1		1				1																															1		1		1																		
m_02	In	1	The guard marched the prisoners round the yard.											1	1				1																																															
m_02	In	1	Frank Churchill crossed the street.	1																																																														
m_02	In	1	Emma and Harriet were attacked yesterday.						1		1									1		1																																		1										
m_02	In	1	Fiona might be here by 5 o'clock.		1				1		1																											1																												
sgww85	In	1	I am both expecting to get the job and of the opinion that it is a desirable one.		1										1										1								1						1		1							1								1		1								
